"Variable / Field Name","Form Name","Section Header","Field Type","Field Label","Choices, Calculations, OR Slider Labels","Field Note","Text Validation Type OR Show Slider Number","Text Validation Min","Text Validation Max","Identifier?","Branching Logic (Show field only if...)","Required Field?","Custom Alignment","Question Number (surveys only)"
"hbr_instructions","hbr_questionnaire",,"descriptive","Please consider whether there have been significant times during the last 12 months during which the following statements applied to you. Then please select the option that best describes how well each statement described you during that period.",,,,,,,,,,
"hbr_01","hbr_questionnaire",,"radio","I found it easy to deceive others.","1, Not at all | 2, A little | 3, Moderately | 4, A lot",,,,,,,"y",,
"hbr_02","hbr_questionnaire",,"radio","I deserved special treatment.","1, Not at all | 2, A little | 3, Moderately | 4, A lot",,,,,,,"y",,
"hbr_03","hbr_questionnaire",,"radio","I saw things that were not really there.","1, Not at all | 2, A little | 3, Moderately | 4, A lot",,,,,,,"y",,
"hbr_04","hbr_questionnaire",,"radio","My fantasies felt very real to me.","1, Not at all | 2, A little | 3, Moderately | 4, A lot",,,,,,,"y",,
"hbr_05","hbr_questionnaire",,"radio","I liked having power.","1, Not at all | 2, A little | 3, Moderately | 4, A lot",,,,,,,"y",,
"hbr_06","hbr_questionnaire",,"radio","I felt something was wrong with my body.","1, Not at all | 2, A little | 3, Moderately | 4, A lot",,,,,,,"y",,
"hbr_07","hbr_questionnaire",,"radio","When I had the chance, I chose to be alone rather than with other people.","1, Not at all | 2, A little | 3, Moderately | 4, A lot",,,,,,,"y",,
"hbr_08","hbr_questionnaire",,"radio","My moods were intense and unpredictable.","1, Not at all | 2, A little | 3, Moderately | 4, A lot",,,,,,,"y",,
"hbr_09","hbr_questionnaire",,"radio","My mind was flooded with troubling images of a bad experience.","1, Not at all | 2, A little | 3, Moderately | 4, A lot",,,,,,,"y",,
"hbr_10","hbr_questionnaire",,"radio","I had pains in several parts of my body.","1, Not at all | 2, A little | 3, Moderately | 4, A lot",,,,,,,"y",,
"hbr_11","hbr_questionnaire",,"radio","I felt like I was outside of my body.","1, Not at all | 2, A little | 3, Moderately | 4, A lot",,,,,,,"y",,
"hbr_12","hbr_questionnaire",,"radio","I was happiest when I was alone.","1, Not at all | 2, A little | 3, Moderately | 4, A lot",,,,,,,"y",,
"hbr_13","hbr_questionnaire",,"radio","I found it easy to manipulate others.","1, Not at all | 2, A little | 3, Moderately | 4, A lot",,,,,,,"y",,
"hbr_14","hbr_questionnaire",,"radio","I was bothered by several bodily symptoms (e.g., headache, fatigue or stomach problems) for which there was no clear or sufficient medical explanation.","1, Not at all | 2, A little | 3, Moderately | 4, A lot",,,,,,,"y",,
"hbr_15","hbr_questionnaire",,"radio","I had trouble planning and keeping to schedules.","1, Not at all | 2, A little | 3, Moderately | 4, A lot",,,,,,,"y",,
"hbr_16","hbr_questionnaire",,"radio","I lost things that I needed.","1, Not at all | 2, A little | 3, Moderately | 4, A lot",,,,,,,"y",,
"hbr_17","hbr_questionnaire",,"radio","I was frustrated with having to convince others I had a real illness.","1, Not at all | 2, A little | 3, Moderately | 4, A lot",,,,,,,"y",,
"hbr_18","hbr_questionnaire",,"radio","Even when I was very careful, I worried whether I had done something correctly.","1, Not at all | 2, A little | 3, Moderately | 4, A lot",,,,,,,"y",,
"hbr_19","hbr_questionnaire",,"radio","Reading articles about disease made me worry about my health.","1, Not at all | 2, A little | 3, Moderately | 4, A lot",,,,,,,"y",,
"hbr_20","hbr_questionnaire",,"radio","I paid my bills late or missed other important deadlines.","1, Not at all | 2, A little | 3, Moderately | 4, A lot",,,,,,,"y",,
"hbr_21","hbr_questionnaire",,"radio","I could feel changes in my body.","1, Not at all | 2, A little | 3, Moderately | 4, A lot",,,,,,,"y",,
"hbr_22","hbr_questionnaire",,"radio","I was disgusted with myself.","1, Not at all | 2, A little | 3, Moderately | 4, A lot",,,,,,,"y",,
"hbr_23","hbr_questionnaire",,"radio","I felt on guard and on edge.","1, Not at all | 2, A little | 3, Moderately | 4, A lot",,,,,,,"y",,
"hbr_24","hbr_questionnaire",,"radio","I was a messy person.","1, Not at all | 2, A little | 3, Moderately | 4, A lot",,,,,,,"y",,
"hbr_25","hbr_questionnaire",,"radio","I did things to get others to notice me.","1, Not at all | 2, A little | 3, Moderately | 4, A lot",,,,,,,"y",,
"hbr_26","hbr_questionnaire",,"radio","I noticed small changes to how my body feels.","1, Not at all | 2, A little | 3, Moderately | 4, A lot",,,,,,,"y",,
"hbr_27","hbr_questionnaire",,"radio","Things went best when I told others what to do.","1, Not at all | 2, A little | 3, Moderately | 4, A lot",,,,,,,"y",,
"hbr_28","hbr_questionnaire",,"radio","I heard things that no one else could hear.","1, Not at all | 2, A little | 3, Moderately | 4, A lot",,,,,,,"y",,
"hbr_29","hbr_questionnaire",,"radio","I was never on time.","1, Not at all | 2, A little | 3, Moderately | 4, A lot",,,,,,,"y",,
"hbr_30","hbr_questionnaire",,"radio","I had no interest in romantic relationships.","1, Not at all | 2, A little | 3, Moderately | 4, A lot",,,,,,,"y",,
"hbr_31","hbr_questionnaire",,"radio","Romantic relationships seemed like a hassle to me.","1, Not at all | 2, A little | 3, Moderately | 4, A lot",,,,,,,"y",,
"hbr_32","hbr_questionnaire",,"radio","I said things without thinking.","1, Not at all | 2, A little | 3, Moderately | 4, A lot",,,,,,,"y",,
"hbr_33","hbr_questionnaire",,"radio","People told me I was coldhearted.","1, Not at all | 2, A little | 3, Moderately | 4, A lot",,,,,,,"y",,
"hbr_34","hbr_questionnaire",,"radio","I made decisions quickly without thinking them through.","1, Not at all | 2, A little | 3, Moderately | 4, A lot",,,,,,,"y",,
"hbr_35","hbr_questionnaire",,"radio","I quit tasks that became too challenging.","1, Not at all | 2, A little | 3, Moderately | 4, A lot",,,,,,,"y",,
"hbr_36","hbr_questionnaire",,"radio","I had a hard time asserting myself to others.","1, Not at all | 2, A little | 3, Moderately | 4, A lot",,,,,,,"y",,
"hbr_37","hbr_questionnaire",,"radio","I felt that I did not want to be in a close relationship.","1, Not at all | 2, A little | 3, Moderately | 4, A lot",,,,,,,"y",,
"hbr_38","hbr_questionnaire",,"radio","I had trouble telling whether something really happened or I just imagined it.","1, Not at all | 2, A little | 3, Moderately | 4, A lot",,,,,,,"y",,
"hbr_39","hbr_questionnaire",,"radio","I felt that things around me were not real.","1, Not at all | 2, A little | 3, Moderately | 4, A lot",,,,,,,"y",,
"hbr_40","hbr_questionnaire",,"radio","I liked attracting the attention of others.","1, Not at all | 2, A little | 3, Moderately | 4, A lot",,,,,,,"y",,
"hbr_41","hbr_questionnaire",,"radio","I was afraid that I might suffer from a serious illness","1, Not at all | 2, A little | 3, Moderately | 4, A lot",,,,,,,"y",,
"hbr_42","hbr_questionnaire",,"radio","I thought a lot about death.","1, Not at all | 2, A little | 3, Moderately | 4, A lot",,,,,,,"y",,
"hbr_43","hbr_questionnaire",,"radio","I bought much more than I needed.","1, Not at all | 2, A little | 3, Moderately | 4, A lot",,,,,,,"y",,
"hbr_44","hbr_questionnaire",,"radio","I was overwhelmed by anxiety.","1, Not at all | 2, A little | 3, Moderately | 4, A lot",,,,,,,"y",,
"hbr_45","hbr_questionnaire",,"radio","I expected to get treated better than others.","1, Not at all | 2, A little | 3, Moderately | 4, A lot",,,,,,,"y",,
